{"$schema":"http://json-schema.org/draft-07/schema#","type":"object","required":["manifest_type","run_id","started_at","ended_at","checksum"],"properties":{"manifest_type":{"const":"run"},"run_id":{"type":"string"},"started_at":{"type":"string"},"ended_at":{"type":"string"},"status":{"type":"string"},"source_counts":{"type":"object"},"generated_pages":{"type":"array"},"output_count":{"type":"integer"},"notes":{"type":"array"},"created_at":{"type":"string"},"version":{"type":"integer"},"checksum":{"type":"string"}}}