{
  "checksum": "bf3ed6630eea944f8329ab651eb13c1680e84a9082b98baf31fe797150196a70",
  "created_at": "2026-05-27T11:40:51Z",
  "ended_at": "2026-05-27T11:40:51Z",
  "generated_pages": [],
  "manifest_type": "run",
  "notes": [],
  "output_count": 0,
  "run_id": "20260527T114044Z",
  "source_counts": {
    "arxiv": 100,
    "hn": 1000,
    "pubmed": 50
  },
  "started_at": "2026-05-27T11:40:44Z",
  "status": "noop",
  "version": 1
}
