{
  "checksum": "acd8524bf17d0e7b1db81ec78984633db727e968d3f276334259cd3b425bc2b5",
  "created_at": "2026-05-28T08:19:11Z",
  "ended_at": "2026-05-28T08:19:11Z",
  "generated_pages": [
    {
      "content_id": "2026-05-28-aml",
      "manifest": "content/pl/blog/2026-05-28-aml/manifest.json",
      "path": "content/pl/blog/2026-05-28-aml/index.md",
      "pillar": "aml"
    },
    {
      "content_id": "2026-05-28-stock",
      "manifest": "content/pl/blog/2026-05-28-stock/manifest.json",
      "path": "content/pl/blog/2026-05-28-stock/index.md",
      "pillar": "stock"
    },
    {
      "content_id": "2026-05-28-science",
      "manifest": "content/pl/blog/2026-05-28-science/manifest.json",
      "path": "content/pl/blog/2026-05-28-science/index.md",
      "pillar": "science"
    }
  ],
  "manifest_type": "run",
  "notes": [],
  "output_count": 3,
  "run_id": "20260528T081735Z",
  "source_counts": {
    "arxiv": 100,
    "hn": 1000,
    "pubmed": 50
  },
  "started_at": "2026-05-28T08:17:35Z",
  "status": "ok",
  "version": 1
}
