{
  "checksum": "420fae2adbe1fc23f410f53e2c032b1499bd35363e5c463422b45f55c06cc371",
  "created_at": "2026-05-23T14:38:13Z",
  "ended_at": "2026-05-23T14:38:13Z",
  "generated_pages": [],
  "manifest_type": "run",
  "notes": [],
  "output_count": 0,
  "run_id": "20260523T143812Z",
  "source_counts": {
    "arxiv": 100,
    "hn": 1000
  },
  "started_at": "2026-05-23T14:38:12Z",
  "status": "noop",
  "version": 1
}
